<?xml version='1.0' encoding='UTF-8'?>
<dataset xmlns:xsi="http://www.w3.org/2001/XMLSchema-instance" xsi:noNamespaceSchemaLocation="dataset.xsd">

    <PROBLEMA ID="1" NOMBRE="Ordenar"/>
    
    <DISCRIMINANTE ID="1" NOMBRE="OrdenamientoNulo"/>
    <MODULO ID="1" IDENTIFICACION="OrdenamientoNulo" VERSION="1"/>
    
    <!--           -->
    <!-- Seleccion -->
    <!--           -->
    <DISCRIMINANTE ID="2" NOMBRE="OrdenamientoPorSeleccion"/>
    <MODULO ID="2" IDENTIFICACION="OrdenamientoPorSeleccion" VERSION="1"/>

    <DISCRIMINANTE ID="3" NOMBRE="Comparaciones" ENTORNO_ID="2"/>
    <CATEGORIA ID="3" MODULO_ID="2"/>

    <DISCRIMINANTE ID="4" NOMBRE="Intercambios" ENTORNO_ID="2"/>
    <CATEGORIA ID="4" MODULO_ID="2"/>
    
    <!-- 1er Registro -->
    <REGISTRODEEJECUCION ID="1" PROBLEMA_ID="1" MODULO_ID="2" DIMENSION="10" INICIO="2013-04-22 11:23:33.000000001" FIN="2013-04-22 11:23:33.000000054"/>
    <MEDIDA ID="1" MAGNITUD="100" UNIDAD="INSTRUCCIONES"/>
    <MEDICION ID="1" DISCRIMINANTE_ID="2" EJECUCION_ID="1" RESULTADO_ID="1"/>
    
    <MEDIDA ID="2" MAGNITUD="91" UNIDAD="INSTRUCCIONES"/>
    <MEDICION ID="2" DISCRIMINANTE_ID="3" EJECUCION_ID="1" RESULTADO_ID="2"/>
    
    <MEDIDA ID="3" MAGNITUD="9" UNIDAD="INSTRUCCIONES"/>
    <MEDICION ID="3" DISCRIMINANTE_ID="4" EJECUCION_ID="1" RESULTADO_ID="3"/>

    <!-- 2do Registro -->
    <REGISTRODEEJECUCION ID="2" PROBLEMA_ID="1" MODULO_ID="2" DIMENSION="20" INICIO="2013-04-22 12:23:33.000000001" FIN="2013-04-22 12:23:33.000000054"/>
    <MEDIDA ID="4" MAGNITUD="400" UNIDAD="INSTRUCCIONES"/>
    <MEDICION ID="4" DISCRIMINANTE_ID="2" EJECUCION_ID="2" RESULTADO_ID="4"/>
    
    <MEDIDA ID="5" MAGNITUD="381" UNIDAD="INSTRUCCIONES"/>
    <MEDICION ID="5" DISCRIMINANTE_ID="3" EJECUCION_ID="2" RESULTADO_ID="5"/>
    
    <MEDIDA ID="6" MAGNITUD="19" UNIDAD="INSTRUCCIONES"/>
    <MEDICION ID="6" DISCRIMINANTE_ID="4" EJECUCION_ID="2" RESULTADO_ID="6"/>
    
    <!-- 3do Registro -->
    <REGISTRODEEJECUCION ID="3" PROBLEMA_ID="1" MODULO_ID="2" DIMENSION="20" INICIO="2013-04-22 12:25:33.000000001" FIN="2013-04-22 12:26:33.000000054"/>
    <MEDIDA ID="7" MAGNITUD="408" UNIDAD="INSTRUCCIONES"/>
    <MEDICION ID="7" DISCRIMINANTE_ID="2" EJECUCION_ID="2" RESULTADO_ID="7"/>
    
    <MEDIDA ID="8" MAGNITUD="387" UNIDAD="INSTRUCCIONES"/>
    <MEDICION ID="8" DISCRIMINANTE_ID="3" EJECUCION_ID="3" RESULTADO_ID="8"/>
    
    <MEDIDA ID="9" MAGNITUD="21" UNIDAD="INSTRUCCIONES"/>
    <MEDICION ID="9" DISCRIMINANTE_ID="4" EJECUCION_ID="3" RESULTADO_ID="9"/>
    
</dataset>