<?xml version='1.0' encoding='UTF-8'?>
<dataset xmlns:xsi="http://www.w3.org/2001/XMLSchema-instance" xsi:noNamespaceSchemaLocation="dataset.xsd">

    <DISCRIMINANTE ID="1" NOMBRE="BusquedaSecuencial"/>
    <MODULO ID="1" IDENTIFICACION="BusquedaSecuencial" VERSION="1"/>

    <DISCRIMINANTE ID="2" NOMBRE="BusquedaBinaria"/>
    <MODULO ID="2" IDENTIFICACION="BusquedaBinaria" VERSION="1"/>
    
    <DISCRIMINANTE ID="3" NOMBRE="OrdenamientoPorSeleccion"/>
    <MODULO ID="3" IDENTIFICACION="OrdenamientoPorSeleccion" VERSION="2"/>
    
    <PROBLEMA ID="1" NOMBRE="Buscar"/>

    <MEDIDA ID="100" MAGNITUD="276" UNIDAD="INSTRUCCIONES"/>
    <REGISTRODEEJECUCION ID="10" PROBLEMA_ID="1" MODULO_ID="2" DIMENSION="1000" INICIO="2013-04-22 11:23:33.000000001" FIN="2013-04-22 11:23:33.000000054"/>
    <MEDICION ID="100" DISCRIMINANTE_ID="2" EJECUCION_ID="10" RESULTADO_ID="100"/>
     
    <PROBLEMA ID="2" NOMBRE="Ordenar"/>
    
    <MEDIDA ID="201" MAGNITUD="1002" UNIDAD="INSTRUCCIONES"/>
    <REGISTRODEEJECUCION ID="21" PROBLEMA_ID="2" MODULO_ID="3" DIMENSION="10" INICIO="2013-11-05 13:21:23.000000001" FIN="2013-11-05 13:22:38.000000154"/> 
    <MEDICION ID="201" DISCRIMINANTE_ID="3" EJECUCION_ID="21" RESULTADO_ID="201"/>     

    <MEDIDA ID="202" MAGNITUD="4102" UNIDAD="INSTRUCCIONES"/>
    <REGISTRODEEJECUCION ID="22" PROBLEMA_ID="2" MODULO_ID="3" DIMENSION="20" INICIO="2013-11-05 14:21:23.000000001" FIN="2013-11-05 14:22:38.000000154"/> 
    <MEDICION ID="202" DISCRIMINANTE_ID="3" EJECUCION_ID="22" RESULTADO_ID="202"/>     

    <MEDIDA ID="203" MAGNITUD="2005" UNIDAD="INSTRUCCIONES"/>
    <REGISTRODEEJECUCION ID="23" PROBLEMA_ID="2" MODULO_ID="3" DIMENSION="15" INICIO="2013-11-05 14:25:58.000000754" FIN="2013-11-05 14:29:08.000000879"/> 
    <MEDICION ID="203" DISCRIMINANTE_ID="3" EJECUCION_ID="23" RESULTADO_ID="203"/>     

</dataset>